Brand,Model,Star,Title,Date,Pros,Cons,Other,Voted_Y,Voted_N
HP,8440P,2,Not completely bad,2015-11-11,"Pros:Very clean, and sleek laptop. Everything is included that should be, and runs well so far.","Cons:The battery only last 30 minutes, so if you actually wanted a laptop and not a desktop, it doesn't work for that. Also they don't take calls for repairs, or tech support. There is a recording saying they are revamping the dpt. leave a message, and after leaving one they won't call you back a week later. Last, unless you are somewhat computer literate you will not be getting windows to work, since they install a different version then the key provided.","Other Thoughts:If you want to buy a referb go somewhere besides newegg. With a 10% restocking fee it is just a huge risk to take. Now I have to decide if 10% is worth it to try and get a laptop with a battery, and warranty I can use.",3,1
Lenovo,T520,5,As good as it gets!!,2016-01-16,Pros:-delivered a day ahead of schedule-nicely packaged-very clean-met or exceeded all the specs-flawless image-everything works and tests at 100%-70% capacity left on battery,Cons:-none that I have run into after two days of configuration including moving to Win10 Pro [and *that* is unusual!!],Other Thoughts:-actually has greater than spec for a number of important features!! AST rocks!-this is as good an experience with a refurbisher as I have had! Thanks Newegg!,0,0
Lenovo,T520,3,"It's a reasonable machine, and decent mix of components for the money, but a missing hard drive caddy meant extra parts before it could be considered reliable.",2016-01-11,"Pros:Decent performance for the price point, including RAM and HDD.","Cons:HDD was installed without hard drive caddy, which meant it would come lose when the laptop was moved.","Other Thoughts:The missing part is small and inexpensive enough that it is not a big deal, but I would have preferred not to have had to go through the trouble of finding another one to make the machine usable.",0,0
DELL,E5440,5,Joy Systems refurbished E5440,2018-04-23,Pros:We bought this from Joy Systems and the packaging is professional. Comes wrapped and protected. Body is clean with very little scuffs.Powers up fine and works great.Cheap price.Comes with instructions and a refurbished Windows 10 key.Comes mostly charged.,Cons:Nothing I could really think of.,,0,0
DELL,E5440,5,Excellent Price and performance,2018-04-23,"Pros:Decent battery life, good price, decent power",Cons:Sometimes the keycap/wrist rest decals are not applied properly.,Other Thoughts:We purchase a large number of these laptops for our clients are are very rarely disappointed.,0,0
DELL,E7450,5,Awesom dell laptop for the great price!,2018-03-05,Pros:It comes with 14'' display with solid hardware unit for the price. 8 gb Ram and 128 SSD makes the system run fast.,Cons:I have no complains so far.,,0,0
DELL,E7450,5,"Great Product, so excited to get such an awesome laptop at such a great price",2018-02-23,"Pros:this laptop is sturdy, dependable, fast, easy to use, just the right size.   I have had one of these as a work computer for years and have not had any issues with it.  Cannot wait to use it at home",Cons:None found,Other Thoughts:I would recommend this product.... just what is needed for managing home / household needs.,0,0
Lenovo,T420,1,not a good decision,2019-03-16,Pros:no pros here,"Cons:I knew the product was refurbished, but did not expect it not to work straight out of the box",,0,0
Lenovo,T420,5,Unbelievable!,2018-12-16,Pros:The notebook just like new one and it is still a beast even it is an old model of Lenovo thinkpad.The harddisk inside is 7200 rpm fast hitachi hddThe delivery time is around 10 working daysPre-loaded windows 10 professional is great!I love Newegg good service and product and would recommend to all of my friends!,Cons:Just a little bit heavy,,1,0
DELL,E6540,2,Joy Systems is a ripoff - their grading system was horribly wrong in my case - this is NOT a grade B system,2018-12-14,"Pros:Needed a laptop for a teen, this seemed like a good deal - i5 processor, 8 GB RAM, and 500GB hard drive ...  $280","Cons:Joy Systems totally exaggerated the Grade B condition of this unit - it is fairly scratched-up (in-line with Grade B), but the battery was cracked in 2 places (which Joy Systems claimed is normal for Grade B - bullcrap), and they shipped it to me with a charging cord that did not REMOTELY fit the unit. They then refused to express-ship replacement parts - they're sending UPS ground instead.","Other Thoughts:I would buy refurb again, but not with Joy Systems as the vendor.",0,0
DELL,E6540,5,Good refurbished laptop,2017-08-11,"Pros:I've gotten quite a few refurbished systems from Joy systems and have always been very happy with them. They don't load their Windows images with bloatware and any issues I have had have been resolved quickly.This particular laptop was in great shape for a B grade, no noticeable wear and everything functions properly. I use these in automotive shops where it isn't worth paying for a new laptop when a great refurbished unit like this works fine.","Cons:No cons so far, you're not buying a new laptop so any blemishes are to be expected. (this one had none)","Other Thoughts:If you're looking for a nearly new laptop, these are a great choice. I'll be purchasing several more in the coming week.s",0,0
DELL,E6440,5,Good computer janky charger,2017-12-08,"Pros:Great price and the computer runs great, no complaints on the computer",Cons:The charger broke immediately,Other Thoughts:I need to buy a new charger but the computer is a great price,0,0
DELL,E6440,3,Good computer. Charger sucks,2017-12-08,Pros:Computer runs smoothly,Cons:The off brand charger broke immediately,Other Thoughts:I wish I could actually use it,1,0
Lenovo,t520,5,"Lenovo B Grade Laptop t520 Intel Core i5 2520M (2.50 GHz) 4 GB Memory 250 GB HDD 15.6"" Windows 7 Home Premium 64-Bit",2016-12-10,Pros:Great Deal. Fresh Windows 7 install with no bloatware. My machine has a 320 GB hard drive instead of 250 like advertised.,Cons:I should have ordered two.,Other Thoughts:It is like brand new with no wear or scratches and runs really fast for an I5 processor.,1,0
Lenovo,t520,1,spotty QA,2015-12-27,Pros:- Great price for the spec- Great RMA process,Cons:- did not work when arrived- usb port on left side completely broken out- left touch pad botton did not work- CPU overheadted in about 10min of running- Waiting on RMA,Other Thoughts:- would not recommend,3,0
HP,8460P,1,Shipped with only 4 Gb RAM,2017-05-31,Pros:Okay otherwise.,Cons:Complete waste of time.,Other Thoughts:Returning for refund. What a pain.,0,0
HP,8460P,4,Just what I needed,2017-05-28,Pros:-Sturdy and simple. It has everything I need!,"Cons:-Didn't realize it has no speaker or microphone. It has a webcam, but when I Skyped I heared nothing and the otherside was the same.-No HDMI port, but that series of HPs are like that. I knew this when buying and the adaptor part is only $20.",,0,0
DELL,E6540,2,Joy Systems is a ripoff - their grading system was horribly wrong in my case - this is NOT a grade B system,2018-12-14,"Pros:Needed a laptop for a teen, this seemed like a good deal - i5 processor, 8 GB RAM, and 500GB hard drive ...  $280","Cons:Joy Systems totally exaggerated the Grade B condition of this unit - it is fairly scratched-up (in-line with Grade B), but the battery was cracked in 2 places (which Joy Systems claimed is normal for Grade B - bullcrap), and they shipped it to me with a charging cord that did not REMOTELY fit the unit. They then refused to express-ship replacement parts - they're sending UPS ground instead.","Other Thoughts:I would buy refurb again, but not with Joy Systems as the vendor.",0,0
DELL,E6540,5,Good refurbished laptop,2017-08-11,"Pros:I've gotten quite a few refurbished systems from Joy systems and have always been very happy with them. They don't load their Windows images with bloatware and any issues I have had have been resolved quickly.This particular laptop was in great shape for a B grade, no noticeable wear and everything functions properly. I use these in automotive shops where it isn't worth paying for a new laptop when a great refurbished unit like this works fine.","Cons:No cons so far, you're not buying a new laptop so any blemishes are to be expected. (this one had none)","Other Thoughts:If you're looking for a nearly new laptop, these are a great choice. I'll be purchasing several more in the coming week.s",0,0
