Brand,Model,Star,Title,Date,Pros,Cons,Other
AMD,YD270XBGAFBOX,5,Smooth,2018-08-12,Pros:8 cores. Good ram timings.,Cons:nothing to speak of!,"Other Thoughts:Came from a good 8350 system running 16 gigs of ram. This and 16 gigs ddr4 is so much smoother. I really notice the difference in games. Easy 10- 20 frames better with just the CPU upgrade. G.SKILL Ripjaws V Series 16GB (2 x 8GB) 288-Pin DDR4 SDRAM DDR4 3200 (PC4 25600) Desktop Memory Model F4-3200C14D-16GVR  and for a drive, WD Black NVMe M.2 2280 500GB PCI-Express 3.0 x4 3D NAND Internal Solid State Drive (SSD) WDS500G2X0C , mobo> MSI X470 GAMING PRO CARBON AM4 AMD X470 SATA 6Gb/s USB 3.1 HDMI ATX AMD Motherboard . Not disappointed in the least."
AMD,YD270XBGAFBOX,5,None,2018-08-06,"Pros:Fast, cost efficient",Cons:None,None
AMD,YD270XBGAFBOX,5,Good for many needs,2018-08-04,Pros:8 cores without breaking the bank,Cons:I can't find a true con,Other Thoughts:My review is biased. I upgraded from an Ivy Bridge i7 running Linux which was being used solely for Android Development. I expected doubling up the cores to noticably speed up the dev workflow. It does not. Going fron 2 > 4 cores was a big boost. going SATA3 > PCIE SSD was a big boost. Going Ryzen 7 meant less responsiveness & mild regressions. Quad-core is enough.This will be great for devs running a lot of VM ot docker containers. Not much help for Android
AMD,YD270XBGAFBOX,5,Second AMD processor I ever owned,2018-08-03,Pros:-Cool Box-RGB Heatsink-Neat case badge,Cons:-Mounting system is dated and was a pain to install,Other Thoughts:Installed this on a x470 ASUS ROG motherboard with no issues. When gaming I touched 63-65C with monitoring from Ryzen Master software. I am waiting for my AM4 kit to arrive for my H80i GT liquid cooler as I am not a fan of stock heatsinks. No instability whatsoever to report with a full days testing. 8 cores and 16 threads is plenty for me to grow into. Highly recommend this processor but just know you need a AM4 motherboard and a X470 chipset that is optimized for Ryzen 2. I cannot speak for X370.
AMD,YD270XBGAFBOX,5,"Duuuude, You're Getting a Ryzen",2018-08-02,"Pros:- Posted without issues as some others have mentioned (installed on an ASUS Prime x470-Pro).- Overclocks, and then overclocks some more. For those less inclined to configure your OC settings in the BIOS, it pretty much overclocks itself with very little effort. I still recommend getting a mobo with decent OC support in order to squeeze even more out of this beast. CPUz benchmarks scored above average out of the box, so I'm very happy with the chip I received.- Running 2x 8gb G.Skill TridentZ RGB at 3600mhz and tighter timings than advertised. This says more about the RAM and motherboard, but the 2700x is able to remain stable while overclocked even with my out-of-spec RAM timings.",Cons:- Doesn't float?,"Other Thoughts:- I needed to update my BIOS to get rid of some very slight stuttering I noticed on the first boot. I knew that I needed to update the BIOS to get the best functionality, just mentioning this for others. The platform is still new-ish, and performance will continue to increase as it matures and motherboard manufacturers update their products. If you're purchasing a new motherboard to support this CPU, it would probably be wise to go with a brand that regularly issues BIOS fixes/updates for the near future.- The included heatsink's (AMD Wraith Prism) LED lighting isn't my cup of tea, but it's really just an optional feature. The heatsink is a bit wide vs. tall, and it is worth noting that it might make some setups cramped. No complaints here, as it was awesome to receive an aftermarket-level heatsink along with the CPU."
AMD,YD270XBGAFBOX,5,Best for the price,2018-08-01,"Pros:140+ fps gaming! Easy to stream w/ without lagging or stutter. I'm impressed with the stock cooler, it can handle most tasks with quiet fan speeds.",Cons:none,None
AMD,YD270XBGAFBOX,4,"It's a small, gray square that does magic",2018-07-30,Pros:It processes things quickly.It processes a lot of things at once even faster.What can I say? It's a processor.,"Cons:Single core performance benches only slightly better (in my setup) than that of my old FX-8350, and it's inconsistent between runs.It seems to really struggle with virtual machines, even more than my old processor, and my old-old Phenom II X4!","Other Thoughts:I only took one egg off even with the cons listed because I can't imagine that all my issues are caused by the processor. My Motherboard (ASRock Fatal1ty X470 Gaming K4) is a very strange animal, and I may be able to blame it for some of this.If you're curious, take a look at my review of it.Also, the included RGB fan is nice."
AMD,YD270XBGAFBOX,5,Not as good as 1800X,2018-07-29,"Pros:1. Easy to overclock. Running stable at 4.1GHz without adjusting the core voltage (did not try more).2. Slightly faster than 1800X in photo processing, but not a must.","Cons:1. This CPU forced me to switch from Win7 to Win10 for missing the USB3.1 drivers. While I am not ready for Win10 yet (though evaluated for several times).2. The CPU stopped working the next morning without any reason, burned out? This never happened before.3. The core temperature reached 80s degree C in processing a photo at 4.1GHz.","Other Thoughts:I purchased this Ryzen 7 2700 to couple with MSI B350 motherboard. I doubt about the quality of the Zen+ or it might require a more powerful cooler (mine is Corsair H55 liquid cooler with double fans).The Ryzen 7 1800X is the best one that I can stay with Win7. I may buy another 1800X or wait for Zen2.But still, I give five stars to AMD processors."
AMD,YD270XBGAFBOX,5,Incredible CPU,2018-07-28,Pros:Fast?  I can't begin to say how fast this is.  Makes everything run smooth as silk. If you have the $$ this would be the cpu to get.,Cons:Nothing but a bit pricey.,None
AMD,YD270XBGAFBOX,2,A-M-D-isaster,2018-07-27,"Pros:first AMD, haven't use it long enough to see any benefits over my previous pc","Cons:Runs HOT!!! idle temps 40C-55C(hot for intel guy like me) ran prime 95 and temps jump to 86C. The idle temps alone worried me, then noticed temps were spiking 40C-65C just  browsing the web. Read the forums for help, people say its normal, been Intel guy all my life so this was not normal to me, also cpu voltages are spiking 1.125v to 1.45v plus the fans throttle up and down from max to normal back to max and was annoying as heck, tried fan curve no luck cant tune it out. The temps were high but safe temps it seems but needed to fix the fan throttling problem.  IF you have temp problems with this CPU listen up...Solved my problem.  Noticed it was boosting to 4.3ghz alot but got my attention when it was boosting just to move the MOUSE, WT F?  the cpu would boost to max if you did anything, background programs also caused it to boost which was why it kept boosting up and down every other second.  AMD Fail is all i gotta say, not saying it sucks, the fan boys are hating on me now :) but out of the box it has lots of problems. So went back to bios decided to try disabling the cpu boost, ""problem solved"".  cpu clocks stay at stock 3.7ghz it'll still down boost but not boost up if that makes any sense, so no more temp spikes. Idle temps are now 30C at idle and normal use like typing an essay or browsing the web dont cause temp spike anymore still at 30C, playing games on steam, temps stabilized at 38c-40c. Rerun prime95 max temps 68C stabilized. Opening web browser or moving the mouse don't cause temp spikes any more.Now that's normal for me.","Other Thoughts:So far not worth the switch to AMD should've stayed with intel. People were raving about how good it is but i don't do rendering or anything that could maximized on the 8 cores so cant test that. Primary use is normal home stuff like typing, movies, internet browsing and some games so not seeing the benefit there. If your thinking of getting your first AMD cpu and you only use it for normal stuff, don't get it, you have to pay attention to what is compatible and whats not. Sometimes they say its compatible and its still not.  AMD cpu are backwards compatible with previous gen motherboards but this can cause some serious headaches as it sometime require a skilled person to tweak the bios.  knew this before buying and still had major problems with this build, not going to bore you with the details, but bought a motherboard with this cpu that others had said was ""plug and play out of the box"" well not so much."
AMD,YD270XBGAFBOX,5,No problems so far,2018-07-23,Pros:-Great speeds-Stable-Should keep you within acceptable performance levels for quite some time.,"Cons:-Had a problem installing the stock cooler. The latches were about 2-3mm too short to attach to the board retention brackets. What should have taken me 2 minutes tops took about half an hour. I was concerned the paste was botched at this point and will be monitoring temps like a hawk. So far according to hwmonitor it idles at 40-45c , plays at 55-65c, and peaks at 70c. CPU-Z stress test for a minute and half capped it out at 78c. Worst case scenario I switch out the coolers but since I'm not planning to OC this seems to be about expected from what I've read and before any throttling. Mobo was Asrock x470 K4 for reference.",Other Thoughts:-I'll definitely be recommending the Ryzen series CPUs to anyone. 2600x was my first option but I got this on a sale that matched my original budget so I figured why not.
AMD,YD270XBGAFBOX,4,Good CPU,2018-07-22,Pros:- It's the top of the line CPU before the Thread Rippah.,Cons:- Probably could have bought a Ryzen 7 1700/1700x/1800x and lose 10% performance and save 50-100 dollars.,"Other Thoughts:It's not the best value, unless you find this on sale. The included CPU cooler is very good and if you actually don't have a CPU cooler than this is a very good deal."
AMD,YD270XBGAFBOX,5,I definitely got a good one,2018-07-20,Pros:FastStable (at standard clocks)Very reasonably priced for the performance vs other brand CPUs,Cons:No cheaper option to buy it without the air cooler,"Other Thoughts:Already had a Ryzen 7 1700.  This dipped price-wise below my ""I'll buy it when it hits this price"" cost threshold.  Was not disappointed.  Updated the mobo UEFI BIOS as required, uninstalled the 1700 and installed the 2700X.  Ran it for a couple days to let thermal paste set.  When I ran the benchmarks, the CPU scored about 2.5% higher than the world average at standard clocks on my ASRock X370 Taichi and with a Samsung 970 EVO 250GB NVMe 2280 M.2 SSD as the OS/boot disk.This CPU line is why I stick with AMD for custom builds.  Best bang for the buck."
AMD,YD270XBGAFBOX,5,Best consumer-grade workstation processor on the market.,2018-07-16,"Pros:With stock settings on a x470 Taichi I get 15% more performance than a stock 1800x and 10% more than a stock 8700k. You need fast ram to achieve this (Samsung B Die). Also, I gained 10% more performance by tightening my secondary ram timings. My primary timings are still at 3200 14-14-14, and by only tweaking the secondary ones using Ryzen Timing Calculator I was able to get a significant CPU performance boost! No need to overclock this baby, xfr2 is awesome!",Cons:Absolutely none. Best purchase I have ever made.,"Other Thoughts:Don't buy this with slow ram. Get Samsung B Die at 3200 14-14-14 minimum or you won't get the most out of your investment. I know the RAM prices are crazy right now, but trust me... it makes a big difference. This processor will tear through anything.I am a music producer. With this thing, I can run massive 30-track orchestral projects with zero latency and live-record on top without any underruns! It's a dream come true!"
AMD,YD270XBGAFBOX,5,Good Upgrade,2018-07-15,Pros:Fast.  Responsive.,Cons:Not sure.,Other Thoughts:Didn't notice much of an upgrade over my fx-8350 at 4.6 GHz.
AMD,YD270XBGAFBOX,5,Best General CPU of 2018,2018-07-14,"Pros:8-Cores = fast performance when I'm multitasking, with multiple things all open/running in Win10Very good gaming performance too!Great top of the line CPU Air Cooler included!",Cons:AMD Ryzen Master software kept putting the CPU into single-core/gaming performance mode but it eventually saved my setting correctly to Creator Mode.,Other Thoughts:Buy a GOOD x470 motherboard for this.  I bought the ASRock Tachi and had zero regrets.  The ASUS ROG Cross VII was my alternative on my NewEgg wishlist.  The Wraith cooler was redundant for my build (I have a 280mm water-cooled radiator in my case) and I resold it in two hours on <name redacted> for $50
AMD,YD270XBGAFBOX,5,"Great CPU , So far  !! Must Buy  !!",2018-07-14,"Pros:Runs as expected ..My Specs :Asus Prime x470 Pro motherboard ( Newest Bios )Thermaltake AIO Floe Riing 360 RGB Premium Edition ( Push-Pull Config , 9 fans . Radiator Front Mount )GPU : Nvidia GTX 1060 Dual 6gbChassis : Corsair 460x RGB ( Switching to Corsair 570x RGB ( White , Just ordered it )Ram Modules : Gskill Trident Z RGB 3200 16gb 8x2PSU : Corsair x750RM ( White )Temps : Idle 22C   Underload : 62.4","Cons:No Cons , So far..","Other Thoughts:If your looking for a great CPU for your everyday needs , Well here it is .. Its fast and efficient..Great for multitasking .This CPU will do it all..I also have the Ryzen 5 1600..Its a great CPU as well..BEWARE, THIS CPU DOES NOT HAVE iGPU..So, u will need a dedicated GPU.."
AMD,YD270XBGAFBOX,5,I am glad I purchased this processor!,2018-07-09,"Pros:Easy to installLove the colors on the CPU fanQuiet, faster compared to previous FX-8350Lives up to the hypePrice to performance is great",Cons:None to me,Other Thoughts:Bought as a combo with AsRock TaiChi Ultimate MB. Both installed flawlessly. Running Windows 10 Pro with 16GB of AdataXPG Gammix D10 DDR4 3000.
AMD,YD270XBGAFBOX,5,Best CPU for $300,2018-07-09,"Pros:- Full 8c/16t- Incredibly fast- Soldered IHS- The included heat-sink performs great, so long as you're not overclocking, and is much better than previous stock heat-sinks from AMD or Intel.","Cons:- Not the best overclocker, don't expect to go above 4.3GHz without some crazy voltage(and cooling). Even then, the processor performs incredibly at the frequencies it hits.","Other Thoughts:Upgraded from an FX-6300, and I'm incredibly happy, and impressed, with the 2700(I have mine OC'd to 4.0GHZ, @1.35v with a Noctua NH-U12S)Great for Streaming/Recording/Encoding/Gaming/anything you throw at it.10/10 would buy again."
AMD,YD270XBGAFBOX,5,Excellent processor,2018-07-08,"Pros:I haven't bought an AMD chip since the Phenom II X4 965 Black way back when... And the reason for that is because the FX successor chips were NOT very good... Really the only good thing about the FX chip was the cheap price...Anyway I digress...I was really skeptical about buying this chip because of the FX series, but AMD really did a fantastic job with the Ryzen processor and it definitely exceeded my expectations, I bought this for a gaming rig and I choose this processor over the i7-8700k for quite a few reasons...- The price. It's about 50 dollars cheaper.- It has 8-cores, and 16 threads. Can you find another processor that has that?- Stock cooler is amazing. It looks beautiful and complimented my Thermaltake View 71 perfectly and it was extremely easy to install on AM4 mobo. I literally placed the CPU in, locked it in place and my board already had the bracket installed I simply snapped it on with the hooks on the cooler and it went on very secure. Oh and not to mention AMD applied liberal thermal paste to the cooler. The i7-8700k doesn't have a cooler, you have to buy. By the time you buy the processor and a good cooler your already at 400+ or maybe 500 dollars if you plan on doing extreme over clocking.- Temps are pretty low at base clocks... Idle around 35-40, when gaming it maxed out at 51c, I even stressed the game with Kingdom Come which is extremely CPU heavy because of Cry Engine , I was getting 60fps at Vhigh Settings with High Def graphics mod enabled @ 1920x1080 with Sapphire Nitro+ RX580. The only thing bottlenecking me with this game is that I don't have a Solid State... (Yet)- I messed around with my asus auto tuning settings, and it OCed the chip about 14% and the temps maxed out at around 70c on a stress test which isn't bad, I have not attempted manual OC and probably won't until I have a better cooler.- Loads windows/apps very fast.I would def recommend this chip to anyone. I think AMD has learned their lesson with their FX chips and is definitely looking to repair their reputation... Which for me, they absolutely have. If you have any reservations or still feel cautious about purchasing AMD's new chips because of previous bad experiences with FX line - you can lay those thoughts to rest.AMD is back.",Cons:- I heard over clocking this thing was a pain in the wazoo.- Not as good as the i7-8700k.,"Other Thoughts:If you plan on using the stock cooler like me, buy a see through case! I got my case loaded down with 8 Thermaltake riing 12 series blue fans, the AMD stock cooler, and my Asus ROG Strix x470-F lights up beautifully!! Looks like Christmas in there!"
AMD,YD270XBGAFBOX,5,Great gaming CPU,2018-07-07,Pros:FastStableCost effective,Cons:Wish its clock speed per core was higher or overclocked better.  Be careful when buying memory for this as this chip benefits greatly from higher clocked ram.,None
AMD,YD270XBGAFBOX,5,Crazy Fast 4.325ghz all cores!,2018-07-07,Pros:My chip runs 4.325ghz on all cores @ 1.35 on MSI x470 M7 AC boardIve seen it self boost to 4.6ghz before my manual overclock (Not on all cores)Stays cool max ive seen with stated overclock is 67C with Thermaltake Water 3.0 Extreme S (This is stress testing it)Beats my I7-4770k @4.3ghz in games like Farcry5 same GTX 1080 (I7 4770k - 70-80 FPS)  (Ryzen 2700x - 100-125fps)Older games they get around the same FPS,Cons:None I might have hit the silicon lottery for once! 4.325 @ 1.35 volts and didn't try any higher. I might push it higher down the road when its towards the end of its life like I did my I7-4770k which I lost  the lottery on lol.,"Other Thoughts:If you want the max FPS right now then go with a Intel I7-8700k and OC it to 5ghz.  The only reason to choose Intel now.If you want to upgrade you CPU 2 years down the road pick AMD!If you want to get more threads/ total CPU power for your money Pick AMD!If you don't want to have to delid you CPU Pick AMD.The core wars have begun and newer games can actually use these threads, and they will continue to be threaded higher and higher to keep the first gen Xbox ones and PS4s running the newer games. So most games will be using 8 threads soon. Ive seen Farcry 5 use all 8 threads of my I7-4770k at 80-95% so yea they use the threads but it you can give it 8 real cores you going to gain some great fps just like I did!"
AMD,YD270XBGAFBOX,5,What A Piece of Work!,2018-07-04,"Pros:This thing is fast and responsive. And, considering it's relatively new, I had some reservations about using it since I wanted to switch to Linux, but the OS and 2700x are working perfectly together and my system is snappy and responsible.",Cons:There are none.,Other Thoughts:Would absolutely recommend. 10/10
AMD,YD270XBGAFBOX,5,OWNS EVERYTHING I THROW AT IT,2018-07-02,"Pros:Upgraded from a AMD FX-6300 and let me tell you just within 3 hours of use I noticed everthing was so much better, programs load fast and fps in games is almost doubled. Im still on the same GTX 960SC and it is a great card but just upgrading to this gives me solid 60FPS at 1080p. Games like Conan Exiles, 7DTD, The Division, BF1, Escape from Tarkov, etc.",Cons:- No RGB on the Processor itself...,Other Thoughts:(Yes that con was a joke)
AMD,YD270XBGAFBOX,5,A Nice improvement over My 1700X,2018-07-01,Pros:Plays games better and my grandson says it renders his videos much faster than the already fast 1700X.Ryzen Master software is much improved for general tweaking and overclockingIt's very good for gaming and superb for content creation.Great price and value!  Intel is nowhere close.,"Cons:They won't let me submit without a con.  So, I guess it could always be less expensive.  Maybe free?...LOL",Other Thoughts:I would recommend this CPU to anyone.I bought another one for my grandson's build
AMD,YD270XBGAFBOX,5,Works well,2018-06-30,Pros:I've been observing the process self-boost faster than advertised with HWMonitor.  The highest seen was 4.5 ghz.  Not sure if the app isn't showing it correctly or AMD sells the 2700 and 2700x as the same chip but with different coolers.,Cons:The stock cooler is barely sufficient.  I knew this going in and bought a Noctua (NH-U12S SE-AM4),Other Thoughts:Look at the 2700x with the stock cooler or this proc with an aftermarket cooler.
AMD,YD270XBGAFBOX,5,It's a tank,2018-06-24,Pros:-heckin fast-stays decently cool under a Kraken X52-16 threads-beats the snot out of my old i7 4790K,Cons:-a difficult overclocker; voltages get pretty insane,Other Thoughts:I found that the most stable settings for this CPU in my system are 4.2Ghz at 1.36 Vcore on an X470 Ultra Gaming board.
AMD,YD270XBGAFBOX,5,Beastly,2018-06-19,"Pros:With good RAM, this thing is awesome!! At stock settings with 3600mhz B-die ram I have consistently pulled 1790 to 1803 on Cinebench. I'm impressed.","Cons:the prism cooler is awesome, if you don't plan on overclocking. I couldn't even pull 3.8 without thermal throttling.",Other Thoughts:I will be investing in an AIO or custom loop in the future... otherwise I'm convinced that I made the right choice.
AMD,YD270XBGAFBOX,5,Great product for streaming amd rendering,2018-06-18,Pros:8 CORES !!! 16 THREADS!!!Very nice box cooler with beautiful RGB,Cons:Not the best in games compared with 8700k,None
AMD,YD270XBGAFBOX,5,Works great.,2018-06-16,Pros:This thing destroys the competition.,Cons:None so far.,None
AMD,YD270XBGAFBOX,5,Great,2018-06-15,Pros:You can hit 4.3 on a aio 1.3875v play games all day. I keep mine at 4.275 at 1.36875v keeps the fan noise down less heat. But 4.3 is do able. My h105i keeps it cooled well even OC. I just don't like my PC to sound like 747.,Cons:None,None
AMD,YD270XBGAFBOX,5,Its a Beast!,2018-06-15,"Pros:- Stock cooler keeps it nice and cool, no need for aftermarket cooling unless you are overclocking.- Chews through everything in its path!",Cons:none thus far,None
AMD,YD270XBGAFBOX,5,Amazing,2018-06-14,"Pros:I haven't owned an AMD processor in ten years.  But I'm glad I pulled the trigger and got this CPU.  It's amazing.  Playing Battlefield 1 in 4K with only 20% CPU usage.  Runs a little hotter than my previous processor, but I have to order and new AIO cooler.  It's disappointing that my Corsair Hydro H105 did not come with a AM4 bracket, so I'm using the included heatsink/fan.  Which is decent.",Cons:None,None
AMD,YD270XBGAFBOX,5,Bought it 2 weeks ago--  awesome,2018-06-12,"Pros:Fast, great, fast, great, get the wraith cooler- awesome",Cons:can't find one,"Other Thoughts:AMD has done their homework as a company.  Great processor, great price, classy, fast. This will do what you need; and then some."
AMD,YD270XBGAFBOX,5,AWESOME cooler and solid boost clocks!,2018-06-11,"Pros:-The Wraith Prism cooler looks incredible. Be sure to download the LIghting tool from Cooler Master and use the USB cable and plug it directly into a USB 2.0 header on your motherboard if you want full independent lighting control.-Works on current AM4 x370 boards with a BIOS update. No more having to buy a whole new board with every CPU like intel makes you do. Updated the BIOS on my Crosshair and everything was fine.-I see boost clocks as high as 4.295GHz on single core, 4GHz all core on medium load, and 3.7-3.9GHz under intense stress testing at stock settings.-Running my GALAX HOF ram at 3200mhz no problem.-8 cores of pure Ryzen goodness.","Cons:-It can't make me a sandwich.-I wish the cooler had a different latching mechanism, but this one does make it compatible with legacy AMD boards so I get it.",Other Thoughts:-Seriously buy it. The multiple advantages this has over the 8700k more than makes up for the small IPC difference.
